,description,preprocessed_description,label,index,tfidf_sum,tfidf_mean,emotions_sum,emotions_mean,text_length,capital_letters_count,numbers_count,question_marks_count,currency_signs_count,capital_words_count,possible_email,possible_address,non_polish_char_count,possible_phone_numbers,personal_info_keywords_count,inspiring_keywords_count,money_related_keywords_count
11," Jeżeli chcesz pracować w stabilnej firmie, dającej narzędzia oraz możliwość pracy zdalnej  dołącz do naszego zespołu! Nienormowany czas pracy, wysokie zarobki, niezależność finansowa, dostęp do rozwoju kompetencji sprzedażowych i możliwej ścieżki kariery menadżerskiej, to tylko niektóre atuty tej pracy. Nie obawiaj się, jeżeli nie masz doświadczenia w sprzedaży. Najważniejsza jest Twoja chęć do pracy, wszystkiego innego Cię nauczymy. Na stronie www.zawoddoradca.pl, o pracy w ubezpieczeniach opowiadają nasi Doradcy i Menedżerowie, serdecznie zapraszam do obejrzenia:)  Oferujemy: pracę w przyjaznej atmosferze, energicznym i wspierającym się wzajemnie, zespole podstawa 4 000 zł  10 000 zł (wysokie prowizje od każdej sprzedaży) bogata oferta benefitów: Ubezpieczenie Grupowe, Pakiet medyczny, Karta Multisport, program emerytalny bazę potencjalnych klientów do kontaktu profesjonalne szkolenia wdrożeniowe i szeroki pakiet szkoleń sprzedażowych w kolejnych etapach kariery wsparcie Menedżera czyli moje zarówno we wdrożeniu w obowiązki jak i przy pozyskiwaniu własnych klientów bonus wdrożeniowy w wysokości 2500 zł  Oczekujemy: wykształcenia minimum średniego – warunek konieczny swobody w prowadzeniu rozmów telefonicznych  posługiwania się poprawną polszczyzną wysokiej kultury osobistej wysokiej skuteczności działania umiejętności budowania relacji umiejętność efektywnego planowania i organizacji pracy własnej uczciwości, solidności i zaangażowania w pracy wysokich zdolności interpersonalnych i negocjacyjnych samodzielności, ambicji i motywacji do osiągania celów komunikatywności i łatwości w nawiązywaniu i utrzymywaniu kontaktów Wyślij nam swoje CV z dopiskiem: ,,Wyrażam zgodę na przetwarzanie moich danych osobowych przez (NationeleNederlanden) w celu prowadzenia rekrutacji na aplikowane przeze mnie stanowisko” ","jeżeć chcieć pracować stabilny firmie, dawać narzędzie możliwość praca zdalny dołączyć zespołu! normować czas pracy, wysoki zarobki, niezależność finansowa, dostęp rozwój kompetencja sprzedażowy możliwy ścieżka kariera menadżerskiej, niektóry atut pracy. n obawiać , mieć doświadczyć sprzedaży. ważny twój chęć pracy, wszystko inny ty nauczymy. nativus strona www.zawoddoradca.pl, praca ubezpieczyć opowiadać doradca menedżerowie, serdeąć zapraszać obejrzenia:) oferujemy: praca przyjazny atmosferze, energiczny wspierający wzajemnie, zespół podstawa 4 000 złoty 10 000 złoty (wysoki prowizja każdy sprzedaży) bogaty oferta benefitów: ubezpieczyć grupowe, pakiet medyczny, karta multisport, program emerytalny baza potencjalny klient kontakt profesjonalny szkolić wdrożeniowy szeroki pakiet szkolić sprzedażowy kolejny etap kariera wsparcie menedżer zarówny wdrożyć obowiązek pozyskiwać własny klient bonus wdrożeniowy wysokość 2500 złoty oczekujemy: wykształcić minimum średni – warunek konieczny swoboda prowadzić rozmówić telefoniczny posługiwać poprawny polszczyzna wysoki kultura osobisty wysoki skuteczność działanie umiejętność budować relacja umiejętność efektywny planowanie organizacja praca własny uczciwości, solidność zaangażowanie praca wysoki zdolność interpersonalny negocjacyjny samodzielności, ambicja motywacja osiągać cel komunikatywność łatwość nawiązywać utrzymywać kontakt wysłać centyvus dopiskiem: ,,wyrażać zgoda przetwarzanie mój dany osobowy (nationelenederlanden) cel prowadzić rekrutacja aplikować przez stanowisko”",1,11,11.32057294376725,0.0070096426896391634,126.0,0.07797029702970297,1834,23,13,1,3,1,,,49,,0,1,2
12, Zatrudnię na stanowisku doradcy klienta w biurze usług płatniczych Wymagania: podstawowa obsługa komputera umiejętność obsługi urządzeń biurowych samodzielność uczciwość chęć do pracy Praca od poniedziałku do piątku 8.0016.00 CV z klauzulą „Wyrażam na przetwarzanie danych osobowych dla potrzeb niezbędnych do realizacji procesu rekrutacji ( zgodnie z Ustawą z dnia 29.08.1997 roku o Ochronie Danych Osobowych; tekst jednolity: DZ. U. 2016 r. poz. 922)”. ,zatrudnić stanowisko doradca klient biuro usługi płatniczy wymagania: podstawowy obsługa komputer umiejętność obsługa urządzić biurowy samodzielność uczciwość chęć praca praca poniedziałek piątek 8.0016.00 centyvus klauzula „wyrażać przetwarzanie dany osobowy potrzeba niezbędny realizacja proces rekrutacja ( zgodni ustawa dzień 29.08.1997 ochrona dany osobowych; tekst jednolity: dz. u. 2016 r. poz. 922)”.,1,12,6.699775418429843,0.0041484677513497475,28.0,0.017326732673267328,456,13,22,0,0,3,,,38,,0,1,0
13,"Poszukujemy osoby do obsługi klienta, która będzie odpowiadać na wiadomości. Praca może być wykonywana zdalnie lub w Warszawie. Jesteśmy dynamicznie rozwijającym się zespołem i poszukujemy osób chętnych do krótko- lub długoterminowej współpracy. Mimo obecnych trudności ekonomicznych, zapewniamy naszym pracownikom godne warunki i wysoki standard życia. Nasz zespół jest stabilny nawet w obliczu inflacji, drożyzny i wysokich podatków. Dołącz do nas i zostań częścią tego zespołu! Oferta pracy może być traktowana jako dodatkowe źródło dochodu obok studiów lub pełnego etatu. Oferujemy atrakcyjne zarobki, które mogą stać się stabilnym i jedynym źródłem dochodu. Współpracujemy z polską firmą, która działa na rynku od ponad 21 lat. Czym będzie polegać Twoja praca? Będziesz odpowiadać na wiadomości ludzi, korzystając z gotowych skryptów i formułek. Wykonywać będziesz także proste zadania związane z promocją i reklamą produktów. Będziesz rekomendować nasze produkty za pomocą systemu online, nie wychodząc z domu. Wystarczy smartfon lub komputer. Uwaga! Nie będziesz musiał/a uczestniczyć w wideokonferencjach. Nie będziesz dzwonić do klientów. Nie będziesz odwiedzać domów klientów. Nie będziesz musiał/a inwestować swoich pieniędzy. Nie wymagamy doświadczenia, nauczymy Cię wszystkiego od podstaw. Nie jesteśmy firmą działającą w marketingu wielopoziomowym (MLM). Co możemy Ci zaoferować? Regularne wypłaty co tydzień, bezpośrednio na Twoje konto bankowe, cztery razy w miesiącu. Pracę w pełni zdalną, możesz pracować z domu lub z dowolnego miejsca na ziemi. Elastyczne godziny pracy - Ty decydujesz, kiedy i ile czasu poświęcasz na pracę. Pełne wsparcie zespołu dostępne 24/7 - zawsze możesz liczyć na pomoc na każdym kroku. Nie wymagamy żadnych inwestycji finansowych w naszej branży. Oferujemy pełne szkolenie online, krok po kroku, zapewnimy Ci wsparcie na każdym etapie. Wymagania: Musisz mieć ukończone 18 lat. Posiadać polskie obywatelstwo. Potrzebujesz komputera lub smartfona z dostępem do internetu. Podstawowa obsługa komputera i smartfona. Umiejętność korzystania z mediów społecznościowych, takich jak Facebook, Messenger i E-mail. Ważne jest, aby być nastawionym na rozwój i aktywnie uczestniczyć w szkoleniach wprowadzających. Oferujemy bardzo atrakcyjne zarobki! Na początku możesz zarabiać około 3700 PLN miesięcznie, pracując tylko 2-3 godziny dziennie. Twoje zarobki będą jednak wzrastać z każdym miesiącem wraz ze zdobytym doświadczeniem, stażem i poświęconym czasem. Zapraszam Cię do skontaktowania się z nami poprzez kliknięcie przycisku ""aplikuj/aplikuj teraz"". Odpowiemy tylko wybranym kandydatom, zastrzegając sobie to prawo. Jeśli ogłoszenie jest widoczne, oznacza to, że jest aktualne.  ","poszukiwać osoba obsługa klienta, odpowiadać wiadomości. praca wykonywać zdalnia warszawie. być dynamicznia rozwijać zespół poszukiwać osoba chętny krótko- długoterminowy współpracy. mimo obecny trudność ekonomicznych, zapewniać nasze pracownik godny warunki wysoki standard życia. nasz zespół stabilny oblicze inflacji, drożyzna wysoki podatków. dołączyć zostać część zespołu! oferta praca traktować dodatkowy źródło dochód studium pełny etatu. oferować atrakcyjny zarobki, stać stabilny jedyny źródło dochodu. współpracować polski firmą, działo rynek 21 . co polegać twój praca? być odpowiadać wiadomość ludzi, korzystać gotowy skrypt formułek. wykonywać być prosty zadanie związać promocja reklama produktów. być rekomendować produkt pomoc system online, wychodzić domu. wystarczyć smartfon komputer. uwaga! n być musiał/ uczestniczyć wideokonferencjach. n być dzwonić klientów. n być odwiedzać domówić klientów. n być musiał/ inwestować swój pieniędzy. n wymagać doświadczenia, nauczyć ty wszystko podstaw. n być firma działać marketing wielopoziomowy (mlm). co móc ty zaoferować? regularny wypłata tydzień, bezpośredni twój konto bankowe, cztery raz miesiącu. praca pełny zdalną, móc pracować dom dowolny miejsce ziemi. elastyczny godzina praca - ty decydujesz, czas poświęcać pracę. pełny wsparcie zespół dostępny 24/7 - móc liczyć pomoc każdy kroku. n wymagać inwestycja finansowy nasz branży. oferować pełny szkolić online, krok kroku, zapewnić ty wsparcie każdy etapie. wymagania: musieć mść ukończyć 18 . posiadać polskie obywatelstwo. potrzebować komputer smartfon dostęp internetu. podstawowy obsługa komputer smartfona. umiejętność korzystać medium społecznościowych, taki facebook, messenger e-mail. ważny , nastawić rozwój aktywn uczestniczyć szkolić wprowadzających. oferować atrakcyjny zarobki! nativus początek móc zarabiać 3700 pln miesięcznie, pracować 2-3 godzina dziennie. twój zarobki wzrastać każdy miesiąc wraz z zdobyć doświadczeniem, staż poświęcony . zapraszać ty skontaktować poprzez kliknięcie przycisk ""aplikuj/aplikować "". odpowiedzieć wybrany kandydatom, zastrzegać prawo. jeśli ogłoszenie widoczne, oznaczać , aktualne.",0,14,12.95761275729486,0.008023289632999914,202.0,0.125,2719,58,13,3,0,2,,,89,,1,3,0
14,"  Poszukujemy Specjalisty ds. Obsługi Klienta, który będzie odpowiedzialny za udzielanie odpowiedzi na wiadomości. Możliwość pracy zdalnej lub stacjonarnej w Warszawie. W związku z dynamicznym rozwojem naszego zespołu, poszukujemy osób zainteresowanych krótko- lub długoterminową współpracą. Mimo trudnego obecnie klimatu gospodarczego, zapewniamy naszym pracownikom godziwe warunki i wysoki standard życia. Jako zespół, stawiamy na stabilność nawet w czasach inflacji, wzrostu cen i obciążeń podatkowych. Dołącz do nas i stań się cennym członkiem naszego zespołu! Praca może być traktowana jako dodatek do studiów lub etatu, jednak atrakcyjne zarobki, które oferujemy, sprawiają, że może ona stanowić stabilne i jedyne źródło dochodu. Współpracujemy z polską firmą, która odnosi sukcesy na rynku od ponad 21 lat. Czym będzie polegać Twoja rola? Będziesz odpowiedzialny za udzielanie odpowiedzi na wiadomości od klientów, korzystając z gotowych skryptów i formułek. Dodatkowo będziesz zajmować się prostymi zadaniami związanymi z reklamą i promocją naszych produktów. Możesz polecać nasze produkty za pomocą specjalnego systemu online, bez konieczności opuszczania swojego domu. Wystarczy mieć smartfon lub komputer. Ważne informacje! Nie będziesz musiał/a uczestniczyć w wideokonferencjach. Nie będziesz wykonywać połączeń telefonicznych do klientów. Nie będziesz odwiedzać klientów w ich domach. Nie będziesz musiał/a inwestować swoich pieniędzy. Nie wymagamy doświadczenia, ponieważ zapewnimy Ci kompleksowe szkolenie. Nie prowadzimy działalności w zakresie marketingu wielopoziomowego (MLM). Co możemy Ci zaoferować? Regularne wypłaty co tydzień, które trafiają bezpośrednio na Twoje konto bankowe cztery razy w miesiącu. Możliwość pracy zdalnej, dającą Ci elastyczność i swobodę wyboru miejsca pracy - możesz pracować z domu lub z dowolnej lokalizacji na świecie. Elastyczne godziny pracy - Ty decydujesz, kiedy i ile czasu poświęcasz na pracę. Pełne wsparcie zespołu, dostępne 24/7 - zawsze będziesz mieć pomoc na każdym etapie. Nie wymagamy żadnych inwestycji finansowych w naszej branży. Oferujemy pełne szkolenie online, krok po kroku, które umożliwi Ci rozwój i osiągnięcie sukcesu. Wymania: Wymagania, które musisz spełnić, to: •	Ukończone 18 lat. •	Obywatelstwo polskie. •	Posiadanie komputera lub smartfona z dostępem do internetu. •	Podstawowa obsługa komputera i smartfona. •	Umiejętność korzystania z mediów społecznościowych, takich jak Facebook, Messenger i E-mail. •	Pozytywne nastawienie do rozwoju i chęć aktywnego uczestnictwa w szkoleniach wprowadzających. Nasza oferta obejmuje również bardzo atrakcyjne zarobki! Na początku możesz otrzymywać około 3700 PLN miesięcznie, pracując tylko 2-3 godziny dziennie. Jednak Twoje zarobki będą systematycznie rosnąć wraz z upływem czasu, zdobytym doświadczeniem oraz poświęconym czasem. Zachęcamy Cię do skontaktowania się z nami poprzez kliknięcie przycisku ""aplikuj/aplikuj teraz"". Pamiętaj, że odpowiemy jedynie wybranym kandydatom, zastrzegając sobie to prawo. Jeśli ogłoszenie jest widoczne, oznacza to, że jest aktualne i wciąż poszukujemy odpowiednich osób do naszego zespołu.  ","poszukiwać specjalista ds. obsługa klienta, odpowiedzialny udzielać odpowiedź wiadomości. możliwość praca zdalny stacjonarny warszawie. wyspa związek dynamiczny rozwój zespołu, poszukiwać osoba zainteresowany krótko- długoterminowy współpracą. mimo trudny obecnie klimat gospodarczego, zapewniać nasze pracownik godziwy warunki wysoki standard życia. jako zespół, stawiać stabilność czas inflacji, wzrost cena obciążyć podatkowych. dołączyć stań cenny członek zespołu! praca traktować dodatek studium etatu, atrakcyjny zarobki, oferujemy, sprawiają, stanowić stabilny jedyny źródło dochodu. współpracować polski firmą, odnosić sukces rynek 21 . co polegać twój rola? być odpowiedzialny udzielać odpowiedź wiadomość klientów, korzystać gotowy skrypt formułek. dodatkowy być zajmować prosty zadanie związać reklama promocja produktów. móc polecać produkt pomoc specjalny system online, konieczność opuszczać swój domu. wystarczyć mść smartfon komputer. ważny informacje! n być musiał/ uczestniczyć wideokonferencjach. n być wykonywać połączyć telefoniczny klientów. n być odwiedzać klient domach. n być musiał/ inwestować swój pieniędzy. n wymagać doświadczenia, zapewnić ty kompleksowy szkolenie. n prowadzić działalność zakres marketing wielopoziomowy (mlm). co móc ty zaoferować? regularny wypłata tydzień, trafiać bezpośredni twój konto bankowy cztery raz miesiącu. możliwość praca zdalnej, dawać ty elastyczność swoboda wybór miejsce praca - móc pracować dom dowolny lokalizacja świecie. elastyczny godzina praca - ty decydujesz, czas poświęcać pracę. pełny wsparcie zespołu, dostępny 24/7 - być mść pomoc każdy etapie. n wymagać inwestycja finansowy nasz branży. oferować pełny szkolić online, krok kroku, umożliwić ty rozwój osiągnięcie sukcesu. wymania: wymagania, musieć spełnić, : • ukończyć 18 . • obywatelstwo polskie. • posiadanie komputer smartfon dostęp internetu. • podstawowy obsługa komputer smartfona. • umiejętność korzystać medium społecznościowych, taki facebook, messenger e-mail. • pozytywny nastawienie rozwój chęć aktywny uczestnictwo szkolić wprowadzających. naszać oferta obejmować atrakcyjny zarobki! nativus początek móc otrzymywać 3700 pln miesięcznie, pracować 2-3 godzina dziennie. jednak twój zarobki systematycznie rosnąć wraz upływ czasu, zdobyć doświadczyć poświęcony . zachęcać ty skontaktować poprzez kliknięcie przycisk ""aplikuj/aplikować "". pamiętaj, odpowiedzieć jedyny wybrany kandydatom, zastrzegać prawo. jeśli ogłoszenie widoczne, oznaczać , aktualny wciążyć poszukiwać odpowiedni osoba zespołu.",0,15,14.244390280298223,0.008820055901113451,230.0,0.14232673267326731,3149,63,13,3,0,3,,,104,,1,5,0
15," Stanowisko: Specjalista ds. Obsługi Klienta - Praca Zdalna lub w Warszawie Ogłoszenia Oferty pracy - Warszawa Kategoria: Praca / Oferty pracy Dodano: 2 Luty 2023 10:11 W związku z dynamicznym rozwojem naszego zespołu, poszukujemy profesjonalisty do obsługi klienta, który będzie odpowiedzialny za skuteczne odpowiadanie na wiadomości. Możesz wybrać pracę zdalną lub biurową w Warszawie. Jesteśmy firmą, która stale się rozwija, i szukamy osób zainteresowanych długotrwałą współpracą. Mimo trudności ekonomicznych, zapewniamy naszym pracownikom stabilne warunki zatrudnienia i wysoki standard życia, niezależnie od inflacji, podwyżek cen i obciążeń podatkowych. Chcemy, abyś dołączył do naszego zespołu! Ta praca może stanowić doskonałe uzupełnienie Twoich studiów lub pełnego etatu, a zarazem oferuje atrakcyjne wynagrodzenie, które może stać się Twoim stabilnym i jedynym źródłem dochodu. Współpracujemy z renomowaną polską firmą, która prosperuje na rynku już od ponad 21 lat. Czym będziesz się zajmować? Twoje obowiązki będą polegać na skutecznym odpowiadaniu na wiadomości od klientów, wykorzystując gotowe skrypty i formułki. Dodatkowo będziesz odpowiedzialny za promocję i reklamę naszych produktów. W ramach pracy online, będziesz polecać produkty za pomocą dedykowanego systemu, bez konieczności wychodzenia z domu - wystarczy, że posiadasz smartfon lub komputer. Ważne informacje! Nie wymagamy uczestnictwa w wideokonferencjach. Nie będziesz wykonywać telefonów do klientów. Nie będziesz odwiedzać klientów w domach. Nie będziesz musiał/a inwestować swoich własnych środków finansowych. Nie potrzebujesz doświadczenia - zapewnimy Ci kompleksowe szkolenie. Nie prowadzimy marketingu wielopoziomowego (MLM). Co możemy Ci zaoferować? Zapewniamy regularne tygodniowe wypłaty, które będą trafiać bezpośrednio na Twoje konto bankowe - aż cztery razy w miesiącu! Dajemy Ci możliwość pracy zdalnej, dzięki czemu możesz pracować z dowolnego miejsca na świecie lub wybrać biuro w Warszawie. Oferujemy elastyczny czas pracy - to Ty decydujesz, kiedy i ile godzin chcesz przeznaczyć na pracę. Zapewniamy pełne wsparcie naszego zespołu, dostępnego dla Ciebie 24/7 - zawsze możesz liczyć nanaszą pomoc na każdym etapie pracy. Nie musisz inwestować swoich pieniędzy, aby do nas dołączyć - działamy w branży bezinwestycyjnej. Oferujemy kompleksowe szkolenie online, w którym krok po kroku pokażemy Ci wszystko, co musisz wiedzieć. Będziemy Cię wspierać i prowadzić za rękę od A do Z, abyś czuł/a się pewnie w wykonywaniu swoich obowiązków. A co z wymaganiami? Wymagamy, abyś: •	Miał/a ukończone 18 lat. •	Posiadał/a polskie obywatelstwo. •	Dysponował/a komputerem lub smartfonem z dostępem do internetu. •	Potrafił/a obsługiwać podstawowe funkcje komputera i smartfona. •	Miał/a umiejętność korzystania z mediów społecznościowych, takich jak Facebook, Messenger i E-mail. •	Był/a nastawiony/a na rozwój i chciał/a aktywnie uczestniczyć w naszych szkoleniach wprowadzających. Przejdźmy teraz do najbardziej interesującego tematu - zarobków! Na początku możesz zarabiać około 3700 PLN miesięcznie, pracując zaledwie 2-3 godziny dziennie. Ale to tylko początek! Twoje zarobki będą rosły wraz z upływem czasu, zdobytym doświadczeniem oraz poświęconym czasem. Jeśli jesteś zainteresowany/a naszą ofertą, zapraszamy do kontaktu poprzez kliknięcie przycisku ""aplikuj/aplikuj teraz"". Pamiętaj, że odpowiemy tylko wybranym kandydatom, zastrzegając sobie to prawo. Jeśli ogłoszenie jest widoczne, to oznacza, że jest aktualne i wciąż poszukujemy odpowiednich osób do naszego zespołu. Dołącz do nas już teraz i rozpocznij satysfakcjonującą karierę jako Specjalista ds. Obsługi Klienta!   ","stanowisko: specjalista ds. obsługa klient - praca zdalny warszawa ogłoszenie oferta praca - warszawa kategoria: praca / oferta praca dodano: 2 luty 2023 10:11 wyspa związek dynamiczny rozwój zespołu, poszukiwać profesjonalista obsługa klienta, odpowiedzialny skuteczny odpowiadać wiadomości. móc wybrać praca zdalny biurowy warszawie. być firmą, stal rozwija, szukać osoba zainteresowany długotrwały współpracą. mimo trudność ekonomicznych, zapewniać nasze pracownik stabilny warunki zatrudnienie wysoki standard życia, niezależnia inflacji, podwyżka cena obciążyć podatkowych. chcemy, abybyć dołączyć zespołu! ten praca stanowić doskonały uzupełnienie twój studium pełny etatu, zaraz oferować atrakcyjny wynagrodzenie, stać twój stabilny jedyny źródło dochodu. współpracować renomowany polski firmą, prosperować rynek 21 . co być zajmować? twój obowiązek polegać skuteczny odpowiadać wiadomość klientów, wykorzystywać gotów skrypt formułki. dodatkowy być odpowiedzialny promocja reklama produktów. wyspa ramy praca online, być polecać produkt pomoc dedykować systemu, konieczność wychodzić dom - wystarczy, posiadać smartfon komputer. ważny informacje! n wymagać uczestnictwo wideokonferencjach. n być wykonywać telefon klientów. n być odwiedzać klient domach. n być musiał/ inwestować swój własny środki finansowych. n potrzebować doświadczyć - zapewnić ty kompleksowy szkolenie. n prowadzić marketing wielopoziomowy (mlm). co móc ty zaoferować? zapewniać regularny tygodniowy wypłaty, trafiać bezpośredni twój konto bankowy - cztery raz miesiącu! dawać ty możliwość praca zdalnej, dzięki móc pracować dowolny miejsce świat wybrać biuro warszawie. oferować elastyczny czas praca - ty decydujesz, godzina chcieć przeznaczyć pracę. zapewniać pełny wsparcie zespołu, dostępny ty 24/7 - móc liczyć nanasz pomoc każdy etap pracy. n musieć inwestować swój pieniędzy, dołączyć - działać branża bezinwestycyjnej. oferować kompleksowy szkolić online, krok krok pokazać ty , musieć wiedzieć. być ty wspierać prowadzić ręka ativus z, abybyć czuł/ pewnie wykonywać swój obowiązków. ativus wymaganiami? wymagamy, abyś: • miał/ ukończyć 18 . • posiadał/ polskie obywatelstwo. • dysponował/ komputer smartfon dostęp internetu. • potrafił/ obsługiwać podstawowy funkcja komputer smartfona. • miał/ umiejętność korzystać medium społecznościowych, taki facebook, messenger e-mail. • był/ nastawiony/ rozwój chciał/ aktywn uczestniczyć szkolić wprowadzających. przejść bardzo interesujący temat - zarobków! nativus początek móc zarabiać 3700 pln miesięcznie, pracować zaldwa 2-3 godzina dziennie. ale początek! twój zarobki rość wraz upływ czasu, zdobyć doświadczyć poświęcony . jeśli być zainteresowany/ nasz ofertą, zapraszać kontakt poprzez kliknięcie przycisk ""aplikuj/aplikować "". pamiętaj, odpowiedzieć wybrany kandydatom, zastrzegać prawo. jeśli ogłoszenie widoczne, oznacza, aktualny wciążyć poszukiwać odpowiedni osoba zespołu. dołączyć rozpocząć satysfakcjonujący kariera specjalista ds. obsługa klienta!",0,16,14.539106939444899,0.009002542996560309,278.0,0.17202970297029702,3671,83,22,6,0,7,,,138,,1,5,0
