,description,preprocessed_description,label,index,tfidf_sum,tfidf_mean,emotions_sum,emotions_mean,text_length,capital_letters_count,numbers_count,question_marks_count,currency_signs_count,capital_words_count,possible_email,possible_address,non_polish_char_count,possible_phone_numbers,personal_info_keywords_count,inspiring_keywords_count,money_related_keywords_count
24,"  1. Przedmiotem oferty jest Konto Bankowe dostępne dla osób bezdomnych lub anonimowych, które może być swobodnie wykorzystywane w dowolnym banku i nie podlega egzekucji komorniczej. 2. Opis przedmiotu: Konto to zostało dedykowane wyłącznie do sprzedaży przedmiotów na platformie Allegro. Szczegółowe informacje dotyczące tej sprawy będą udostępnione tylko zainteresowanym osobom. W zestawie znajdują się dokumenty bankowe, karta SIM oraz skan dowodu tożsamości, które umożliwiają logowanie się do konta online. 3. Cena: 250 zł 4. Kontakt: Prywatna wiadomość 5. Sposób płatności: Kod Blik, Paysafecard lub przelew. Akceptuję jedynie oferty od uczciwych osób o dobrej reputacji na forum. Odpowiem tylko na wiadomości od użytkowników, którzy posiadają czyste konto na forum i cieszą się pozytywnymi opiniami. Przed dokonaniem zakupu wymagam dostępu do konta bankowego w celu weryfikacji. Preferuję płatności za pośrednictwem systemu Escrow, aby uniknąć oszustw i zapewnić ciągłość komunikacji. Nie jestem skłonny zapłacić więcej niż ustalona cena, dopóki nie otrzymam fizycznego dostępu do konta i nie zweryfikuję wszystkich szczegółów. Edytowane 29 września 2020 przez użytkownika konekpl.  ","1. przedmiot oferta konto bankowy dostępny osoba bezdomny anonimowych, swobodnień wykorzystywać dowolny bank podlegać egzekucja komorniczej. 2. opis przedmiotu: konto zostać dedykować wyłącznia sprzedaż przedmiot platforma allegro. szczegółowy informacja dotyczyć sprawa udostępnić zainteresowany osobom. wyspa zestaw znajdywać dokument bankowe, karta sio skan dowód tożsamości, umożliwiać logować konto online. 3. cena: 250 złoty 4. kontakt: prywatny wiadomość 5. sposób płatności: koda blik, paysafecard przelew. akceptować jedyny oferta uczciwy osoba dobry reputacja forum. odpowiedzieć wiadomość użytkowników, posiadać czysty konto forum cieszyć pozytywny opiniami. przed dokonanie zakup wymagać dostęp konto bankowy cel weryfikacji. preferować płatność pośrednictwo system escrow, uniknąć oszustwo zapewnić ciągłość komunikacji. n skłonny zapłacić ustalić cena, doeć otrzymać fizyczny dostęp konto zweryfikować szczegółów. edytować 29 września 2020 użytkownik konekpl.",0,26,9.53378983424789,0.00590327543916278,74.0,0.04579207920792079,1190,25,14,0,1,2,,,41,,3,2,0
25,"  1. Przedmiotem sprzedaży jest Konto Bankowe dedykowane osobom bezdomnym lub anonimowym, które może być łatwo używane w dowolnym banku bez ryzyka zajęcia komorniczego. 2. Opis przedmiotu: Konto to będzie wykorzystywane wyłącznie do sprzedaży przedmiotów na platformie Allegro. Szczegółowe informacje dotyczące tej kwestii zostaną przekazane jedynie zainteresowanym osobom. W zestawie otrzymasz dokumenty bankowe, kartę SIM oraz skan dowodu tożsamości, które pozwolą na logowanie się do konta online. 3. Cena: 250 zł 4. Kontakt: Prywatna wiadomość 5. Sposób płatności: Kod Blik, Paysafecard lub przelew. Akceptuję jedynie oferty od uczciwych osób o dobrej reputacji na forum. Odpowiadam jedynie na wiadomości od użytkowników, którzy mają czyste konto na forum i posiadają pozytywne opinie. Przed dokonaniem zakupu wymagam dostępu do konta bankowego w celu weryfikacji. Preferowany jest system płatności Escrow w celu uniknięcia oszustw i zapewnienia ciągłości kontaktu. Nie jestem skłonny zapłacić więcej niż ustalona cena, dopóki nie otrzymam fizycznego dostępu do konta i nie sprawdzę wszystkich szczegółów. Edytowane 29 września 2020 przez użytkownika konekpl. ","1. przedmiot sprzedaż konto bankowy dedykować osoba bezdomny anonimowym, łatwy używać dowolny bank ryzyko zajęcie komorniczego. 2. opis przedmiotu: konto wykorzystywać wyłącznia sprzedaż przedmiot platforma allegro. szczegółowy informacja dotyczyć kwestia zostać przekazać jedyny zainteresowany osobom. wyspa zestaw otrzymać dokument bankowe, karta sio skan dowód tożsamości, pozwolić logować konto online. 3. cena: 250 złoty 4. kontakt: prywatny wiadomość 5. sposób płatności: koda blik, paysafecard przelew. akceptować jedyny oferta uczciwy osoba dobry reputacja forum. odpowiadać jedyny wiadomość użytkowników, czysty konto forum posiadać pozytywny opinie. przed dokonanie zakup wymagać dostęp konto bankowy cel weryfikacji. preferować systema płatność escroć cel uniknąć oszustwo zapewnienie ciągłość kontaktu. n skłonny zapłacić ustalić cena, doeć otrzymać fizyczny dostęp konto sprawdzić szczegółów. edytować 29 września 2020 użytkownik konekpl.",0,27,9.321063022127008,0.005771556050852637,76.0,0.04702970297029703,1164,25,14,0,1,2,,,40,,3,1,0
26," Poszukujemy osoby, która specjalizuje się w obsłudze klienta i będzie odpowiedzialna za udzielanie odpowiedzi na wiadomości. Istnieje możliwość pracy zdalnej lub stacjonarnej w Warszawie.  Ze względu na dynamiczny rozwój naszego zespołu, poszukujemy osób zainteresowanych współpracą zarówno krótko-, jak i długoterminową. Mimo trudnego klimatu gospodarczego, zapewniamy naszym pracownikom godziwe warunki oraz wysoki standard życia. Jako zespół, dążymy do stabilności nawet w trudnych czasach, takich jak inflacja, wzrost cen i obciążenia podatkowe.  Jeśli dołączysz do nas, staniesz się cennym członkiem naszego zespołu! Praca może być traktowana jako dodatek do studiów lub etatu, ale oferujemy atrakcyjne zarobki, które mogą stanowić stabilne i jedyne źródło dochodu.  Współpracujemy z polską firmą, która odnosi sukcesy na rynku od ponad 21 lat.  Twoja rola polegać będzie głównie na udzielaniu odpowiedzi na wiadomości od klientów, korzystając z gotowych skryptów i formułek. Będziesz również zajmować się prostymi zadaniami związanymi z reklamą i promocją naszych produktów. Możesz polecać nasze produkty za pomocą specjalnego systemu online, bez konieczności opuszczania domu. Wystarczy, że będziesz mieć smartfon lub komputer.  Ważne informacje! Nie będziesz musiał/a uczestniczyć w wideokonferencjach ani wykonywać połączeń telefonicznych do klientów. Nie będziesz również odwiedzać klientów w ich domach ani inwestować swoich pieniędzy. Nie wymagamy doświadczenia, ponieważ zapewnimy Ci kompleksowe szkolenie. Nasza firma nie działa w zakresie marketingu wielopoziomowego (MLM).  Co możemy Ci zaoferować? Oferujemy regularne wypłaty co tydzień, które trafiają bezpośrednio na Twoje konto bankowe cztery razy w miesiącu. Masz również możliwość pracy zdalnej, co daje Ci elastyczność i swobodę wyboru miejsca pracy - możesz pracować z domu lub z dowolnej lokalizacji na świecie. Mamy elastyczne godziny pracy, więc to Ty decydujesz, kiedy i ile czasu poświęcasz na pracę. Oferujemy pełne wsparcie zespołu, które jest dostępne 24/7 - zawsze możesz liczyć na pomoc na każdym etapie. Nie wymagamy żadnych inwestycji finansowych w naszej branży. Oferujemy pełne szkolenie online, krok po kroku, które umożliwi Ci rozwój i osiągnięcie sukcesu.  Wymagania, które musisz spełnić, to:  - Musisz mieć ukończone 18 lat. - Musisz być obywatelem polskim. - Posiadanie komputera lub smartfona z dostępem do internetu. - Powinieneś umieć obsługiwać podstawowe funkcje komputera i smartfona. - Musisz posiadać umiejętność korzystania z mediów społecznościowych, takich jak Facebook, Messenger i E-mail. - Wymagamy pozytywnego nastawienia do rozwoju oraz chęci aktywnego uczestnictwa w szkoleniach wprowadzających.  Nasza oferta obejmuje również bardzo atrakcyjne zarobki! Na początku możesz otrzymywać około 3700 PLN miesięcznie, pracując tylko 2-3 godziny dziennie. Jednak Twoje zarobki będą systematycznie rosnąć wraz z upływem czasu, zdobytym doświadczeniem oraz poświęconym czasem.  Zachęcamy Cię do skontaktowania się z nami poprzez kliknięcie przycisku ""aplikuj/aplikuj teraz"". Pamiętaj, że odpowiemy tylko wybranym kandydatom, zastrzegając sobie to prawo. Jeśli ogłoszenie jest widoczne, oznacza to, że jest aktualne i wciąż poszukujemy odpowiednich osób do naszego zespołu.  ","poszukiwać osoby, specjalizować obsługa klient odpowiedzialny udzielać odpowiedź wiadomości. istnieć możliwość praca zdalny stacjonarny warszawie. z wzgląd dynamiczny rozwój zespołu, poszukiwać osoba zainteresowany współpraca zarówny krótko-, długoterminową. mimo trudny klimat gospodarczego, zapewniać nasze pracownik godziwy warunki wysoki standard życia. jako zespół, dążyć stabilność trudny czasach, taki inflacja, wzrost cena obciążyć podatkowe. jeśli dołączyć , stanąć cenny członek zespołu! praca traktować dodatek studium etatu, oferować atrakcyjny zarobki, stanowić stabilny jedyny źródło dochodu. współpracować polski firmą, odnosić sukces rynek 21 . twój rola polegać głównia udzielać odpowiedź wiadomość klientów, korzystać gotowy skrypt formułek. być zajmować prosty zadanie związać reklama promocja produktów. móc polecać produkt pomoc specjalny system online, konieczność opuszczać domu. wystarczy, być mść smartfon komputer. ważny informacje! n być musiał/ uczestniczyć wideokonferencja ani wykonywać połączyć telefoniczny klientów. n być odwiedzać klient dom ani inwestować swój pieniędzy. n wymagać doświadczenia, zapewnić ty kompleksowy szkolenie. naszać firma działo zakres marketing wielopoziomowy (mlm). co móc ty zaoferować? oferować regularny wypłata tydzień, trafiać bezpośredni twój konto bankowy cztery raz miesiącu. mieć możliwość praca zdalnej, dawać ty elastyczność swoboda wybór miejsce praca - móc pracować dom dowolny lokalizacja świecie. mieć elastyczny godzina pracy, ty decydujesz, czas poświęcać pracę. oferować pełny wsparcie zespołu, dostępny 24/7 - móc liczyć pomoc każdy etapie. n wymagać inwestycja finansowy nasz branży. oferować pełny szkolić online, krok kroku, umożliwić ty rozwój osiągnięcie sukcesu. wymagania, musieć spełnić, : - musieć mść ukończyć 18 . - musieć obywatel polskim. - posiadanie komputer smartfon dostęp internetu. - powinien umść obsługiwać podstawowy funkcja komputer smartfona. - musieć posiadać umiejętność korzystać medium społecznościowych, taki facebook, messenger e-mail. - wymagać pozytywny nastawienie rozwój chęć aktywny uczestnictwo szkolić wprowadzających. naszać oferta obejmować atrakcyjny zarobki! nativus początek móc otrzymywać 3700 pln miesięcznie, pracować 2-3 godzina dziennie. jednak twój zarobki systematycznie rosnąć wraz upływ czasu, zdobyć doświadczyć poświęcony . zachęcać ty skontaktować poprzez kliknięcie przycisk ""aplikuj/aplikować "". pamiętaj, odpowiedzieć wybrany kandydatom, zastrzegać prawo. jeśli ogłoszenie widoczne, oznaczać , aktualny wciążyć poszukiwać odpowiedni osoba zespołu.",0,28,14.337790179803797,0.00887788865622526,233.0,0.14418316831683167,3277,55,13,3,0,2,,,100,,1,5,0
27,"  „Konto bankowe, anonimowe, pewne na 100%! W jednym ze znanych polskich banków. Jest zarejestrowane na osoby bez obciążeń kredytowych, z czystym BIK, brak komornika”. Cena: 700 zł.  **** Dostępne jest konto bankowe o wysokim poziomie poufności i pewności, które należy do jednego z renomowanych polskich banków. To konto zostało zarejestrowane na osobę, która nie posiada żadnych zaległości kredytowych i ma czystą historię w Biurze Informacji Kredytowej (BIK). Dodatkowo, na koncie nie ma żadnych egzekucji komorniczych. Wymagana cena za takie konto to 700 złotych.  ******* Dostępne jest konto bankowe, które gwarantuje pełną anonimowość i wysoki poziom bezpieczeństwa. Konto to zostało otwarte w jednym z popularnych polskich banków. Jest ono zarejestrowane na osobę, która nie posiada żadnych długów kredytowych i posiada czystą historię w Biurze Informacji Kredytowej (BIK). Dodatkowo, na koncie nie ma żadnych zaległości komorniczych. Oferta ta jest dostępna za cenę 700 złotych. ****** Posiadamy konto bankowe, które zapewnia absolutną poufność i niezawodność na poziomie 100%. To konto jest udostępniane przez jedną z dobrze znanych polskich instytucji finansowych. Jest zarejestrowane na osobę, która nie posiada żadnych obciążeń kredytowych i ma nieskazitelny rekord w Biurze Informacji Kredytowej (BIK), a także nie ma żadnych długów, które mogłyby skutkować egzekucją komorniczą. Wymagana opłata za to konto wynosi 700 złotych.  ","„konto bankowe, anonimowe, pewny 100%! wyspa jedno z znany polskie banków. być zarejestrować osoba obciążyć kredytowych, czysty bik, brak komornika”. cena: 700 zł. **** dostępny konto bankowy wysoki poziom poufność pewności, należeć jedno renomowany polskie banków. to konto zostać zarejestrować osobę, posiadać zaległość kredytowy czysty historia biuro informacja kredytowy (bik). dodatkowo, konto egzekucja komorniczych. wymagać cena konto 700 złotych. ******* dostępny konto bankowe, gwarantować pełny anonimowość wysoki poziom bezpieczeństwa. konto zostać otworzyć jedno popularny polskie banków. być zarejestrować osobę, posiadać dług kredytowy posiadać czysty historia biuro informacja kredytowy (bik). dodatkowo, konto zaległość komorniczych. oferta dostępny cena 700 złotych. ****** posiadać konto bankowe, zapewniać absolutny poufność niezawodność poziom 100%. to konto udostępniać jeden znany polskie instytucja finansowych. być zarejestrować osobę, posiadać obciążyć kredytowy nieskazitelny rekord biuro informacja kredytowy (bik), długów, móc skutkować egzekucja komorniczą. wymagać opłata konto wynosić 700 złotych.",0,29,6.830042782093173,0.004229128657642831,94.0,0.05816831683168317,1442,38,18,1,1,5,,,77,,12,3,0
28," Mamy dostępne konto bankowe, które zapewnia pełną poufność oraz niezawodność na poziomie 100%. To konto zostało założone w jednym z popularnych polskich banków. Jest ono zarejestrowane na osobę, która nie posiada żadnych obciążeń kredytowych i ma czystą historię w Biurze Informacji Kredytowej (BIK). Ponadto, na koncie nie ma żadnych wpisów dotyczących windykacji komorniczej. Za takie konto należy uiścić opłatę w wysokości 700 złotych. ","mieć dostępny konto bankowe, zapewniać pełny poufność niezawodność poziom 100%. to konto zostać założyć jedno popularny polskie banków. być zarejestrować osobę, posiadać obciążyć kredytowy czysty historia biuro informacja kredytowy (bik). ponadto, konto wpis dotyczyć windykacja komorniczej. za konto należeć uiścić opłata wysokość 700 złotych.",0,30,5.962280809174081,0.003691814742522651,27.0,0.01670792079207921,440,11,6,0,0,1,,,17,,4,1,0
29,"* Sprzedam konta bankowe bez obciążeń. Dostępne cztery banki. Możliwość korzystania tylko z aplikacji lub zakup pełnego zestawu. P. S nie dostaniesz loginu i hasła przed zakupem ani nie sprawdzisz możliwość logowania. Jest to mój produkt za, który zapłaciłem i nie ma możliwości zmian wymagających wizyty w oddziale (słup nie świadomy). Są 4 konta założone. Wysyłka do paczkomatu.  ","* sprzedać konto bankowy obciążeń. dostępny cztery banki. możliwość korzystać aplikacja zakupić pełny zestawu. pun. syn dostać login hasło zakup ani sprawdzić możliwość logowania. być produkt , zapłacić możliwość zmiana wymagający wizyta oddział (słupić świadomy). być 4 konto założone. wysyłka paczkomatu.",0,31,5.630101063581122,0.003486130689523915,32.0,0.019801980198019802,382,8,1,0,0,2,,,13,,0,0,0
30,"*** Oferuję do sprzedaży konta bankowe bez żadnych obciążeń. Dostępne są cztery banki do wyboru. Istnieje możliwość korzystania wyłącznie z aplikacji lub zakupu pełnego zestawu, w zależności od preferencji.  Uwaga: Przed dokonaniem zakupu nie będzie udostępniony login ani hasło do konta, ani nie będzie możliwości sprawdzenia funkcjonalności logowania. Jest to mój produkt, który nabyłem i nie ma możliwości wprowadzenia żadnych zmian, które wymagałyby odwiedzenia oddziału banku (dla zachowania anonimowości). Dostępne są cztery założone konta. Wysyłka zostanie dokonana do paczkomatu.  ******* Mam na sprzedaż konta bankowe, które są wolne od wszelkich zobowiązań. Dostępne są w czterech różnych bankach. Możliwe jest skorzystanie z nich tylko poprzez aplikację lub zakup pełnego zestawu.  Uwaga: Przed zakupem nie otrzymasz loginu i hasła do konta ani nie będziesz mógł sprawdzić możliwości zalogowania się. To mój produkt, za który zapłaciłem, i nie ma możliwości wprowadzania jakichkolwiek zmian, które wymagałyby wizyty w oddziale (przez wzgląd na zachowanie anonimowości). Dostępne są cztery założone konta. Wysyłka zostanie dokonana do paczkomatu.  ","*** oferować sprzedaż konto bankowy obciążeń. dostępny cztery banka wyboru. istnieć możliwość korzystać wyłącznia aplikacja zakup pełny zestawu, zależność preferencji. uwaga: przed dokonanie zakup udostępnić login ani hasło konta, ani możliwość sprawdzić funkcjonalność logowania. być produkt, nabyć możliwość wprowadzić zmian, wymagać odwieść oddział bank ( zachowanie anonimowości). dostępny cztery założyć konta. wysyłka zostać dokonany paczkomatu. ******* mieć sprzedaż konto bankowe, wolny wszelki zobowiązań. dostępny cztery różny bankach. możliwy skorzystać poprzez aplikacja zakupić pełny zestawu. uwaga: przed zakup otrzymać login hasło konto ani być móc sprawdzić możliwość zalogować . to produkt, zapłaciłem, możliwość wprowadzać jakikolwiek zmian, wymagać wizyta oddział ( wzgląd zachowanie anonimowości). dostępny cztery założyć konta. wysyłka zostać dokonany paczkomatu.",0,32,7.431092570490902,0.004601295709282293,85.0,0.0525990099009901,1158,16,0,0,0,0,,,38,,0,1,0
31,"** Posiadam na sprzedaż konta bankowe, które są całkowicie wolne od jakichkolwiek zaległości. Dostępne są w czterech różnych bankach. Istnieje możliwość skorzystania jedynie z aplikacji lub zakupu pełnego zestawu, w zależności od preferencji.  Uwaga: Przed zakupem nie zostaną udostępnione loginy i hasła do kont, ani nie będzie możliwości przetestowania funkcji logowania. Jest to mój produkt, który został zakupiony, i nie ma możliwości dokonywania jakichkolwiek zmian, które wymagałyby osobistego wizyty w placówce banku (w celu zachowania pełnej anonimowości). Dostępne są cztery konta, które zostały już zarejestrowane. Wysyłka zostanie dokonana do paczkomatu. ","** posiadać sprzedaż konto bankowe, całkowić wolny jakikolwiek zaległości. dostępny cztery różny bankach. istnieć możliwość skorzystać jedyny aplikacja zakup pełny zestawu, zależność preferencji. uwaga: przed zakup zostać udostępnić login hasło kont, ani możliwość przetestować funkcja logowania. być produkt, zakupiony, możliwość dokonywać jakikolwiek zmian, wymagać osobisty wizyta placówka bank ( cel zachowanie pełny anonimowości). dostępny cztery konta, zostać zarejestrowane. wysyłka zostać dokonany paczkomatu.",0,33,6.806492770904722,0.004214546607371345,48.0,0.0297029702970297,666,8,0,0,0,0,,,19,,0,0,0
32,"** Mam na sprzedaż konta bankowe, które są wolne od wszelkich obciążeń. Oferuję cztery różne konta dostępne w renomowanych bankach. Istnieje opcja korzystania z tych kont tylko poprzez aplikację lub zakupu pełnego zestawu.  Ważna informacja: Przed dokonaniem zakupu nie zostaną udostępnione loginy ani hasła do kont, ani nie będzie możliwości sprawdzenia funkcjonalności logowania. To moje produkty, za które zapłaciłem, i nie ma możliwości wprowadzania żadnych zmian, które wymagałyby wizyty w oddziale banku (aby zachować pełną anonimowość). Dostępne są cztery konta, które zostały już zarejestrowane. Wysyłka zostanie dokonana do paczkomatu. ","** mieć sprzedaż konto bankowe, wolny wszelki obciążeń. oferować cztery różny konto dostępny renomowany bankach. istnieć opcja korzystać konto poprzez aplikacja zakup pełny zestawu. ważny informacja: przed dokonanie zakup zostać udostępnić login ani hasło kont, ani możliwość sprawdzić funkcjonalność logowania. to produkty, zapłaciłem, możliwość wprowadzać zmian, wymagać wizyta oddział bank ( zachować pełny anonimowość). dostępny cztery konta, zostać zarejestrowane. wysyłka zostać dokonany paczkomatu.",0,34,6.892056136480152,0.004267527019492354,47.0,0.029084158415841586,645,8,0,0,0,0,,,18,,0,0,0
33,"** Masz problem z komornikiem? Co miesiąc zamraża część Twojej wypłaty związku z zajęciem komorniczym? Nic straconego. Mamy na to sposób, aby twoje 100% twojego wynagrodzenia wpadało tylko do Twojej kieszeni. Super opcja na ominięcie zajęć komorniczych.  Posiadamy pełne różne zestawy w bankach. Zestawy posiadają kilka dni i są zakładane w oddziale. Nie internetowo, więc nie posiadają żadnych blokad i są bez limitu. Są Czyste Nowiutkie i nie mają żadnych śladów użytkowania są zapakowane do wysyłki.  Zestawy są całkowicie bezpieczne i nikt inny nie posiada do nich dostępu, więc twoje pieniądze będą całkowicie bezpieczne i wolne od osób trzecich.   Możemy zapewnić ci gwarancję poprzez pobraniową wysyłkę. możesz kupić 1 sztukę najpierw jeśli wszystko będzie ok to kupujesz kolejne masz 100% pewność że nie stracisz swoich pieniędzy a będziesz wiedział że jesteśmy uczciwi od innych konkurencji i zyskasz więcej kont w tej cenie przekonaj się sam, to jest nasza gwarancja my zapewniamy wam że będziecie zadowoleni z naszych usług.  CENA PODANA W OGŁOSZENIU ZA PEŁNY ZESTAW! w skład wchodzi (dokumenty, karta bankowa, karta sim, skan dowodu, nazwisko panieńskie matki)  TYLKO OSOBY ZDECYDOWANE ZAPRASZAM DO KONTAKTU POPRZEZ PORTAL LUB E-MAIL SŁUŻYMY POMOCĄ, ZAPEWNIAMY 100% GWARANCJI ZAKUPU, SKONTAKTUJ SIĘ Z NAMI SZYBKO ODPOWIADAMY NA WIADOMOŚCI SKORZYSTAJ Z NASZEJ OFERTY NISKA CENA I ZADOWOLENIE KLIENTA TO NASZ OBOWIĄZEK MAMY NAJLEPSZĄ OFERTĘ NA RYNKU.  POSIADAMY WSZYSTKIE ZESTAWY LUB MOŻEMY ZAŁOŻYĆ CI NA INNE DANE!  JEŚLI CHCESZ KUPIĆ WIĘCEJ KONT JEDNOCZEŚNIE DOSTAJESZ RABAT O POŁOWĘ CENY PRZY MIN 5 SZTUK!  ZACHĘCAMY DO ZAKUPU NA PEWNO CI SIĘ OPŁACI SPRAWDŹ NAS! JESTEŚMY KONKURENCYJNI OD INNYCH OFERT!  WYSYŁKA PRZEZ KURIERA INPOST LUB PACZKOMAT MOŻLIWOŚĆ WYSYŁKI ZA POBRANIEM CZAS REALIZACJI ZAMÓWIENIA JEST SZYBKI!  GWARANTUJEMY ZADOWOLENIE KLIENTA I 100% SATYSFAKCJI Z ZAKUPU KONTA, WYSYŁKA JEST WLICZONA W CENE GRATIS! ","** mieć problem komornikiem? co miesiąc zamrażać część twój wypłata związek zajęcie komorniczym? nica straconego. mieć , 100% twój wynagrodzić wpadać twój kieszeni. super opcja ominąć zajęcie komorniczych. posiadać pełny różny zestaw bankach. zestaw posiadać dzień zakładać oddziale. n internetowo, posiadać blokada limitu. być czysty nowiutki ślad użytkowanie zapakować wysyłki. zestaw całkowić bezpieczny nikt posiadać dostępu, pieniądz całkowić bezpieczny wolny osoba trzecich. móc zapewnić gwarancja poprzez pobraniowy wysyłkę. móc kupić 1 sztuka najpierwo oko kupować kolejny mieć 100% pewność stracić swój pieniądz być wiedzieć być uczciwy konkurencja zyskać konto cena przekonać , gwarancja zapewniać być zadowolony usług. cena podać wyspa ogłoszenie za pełny zestaw! skład wchodzić (dokumenty, karta bankowa, karta sim, skan dowodu, nazwisko panieński matki) tylka osoba zdecydowany zapraszać dojciec kontakt poprzez portal lubić e-mail służyć pomocą, zapewniać 100% gwarancja zakupu, skontaktować się ezyt my szybki odpowiadać nativus wiadomość skorzystać ezyt nasz oferta niski cena i zadowolić klient to nasz obowiązek mieć dobry oferta nativus rynku. posiadać wszystek zestaw lubić móc założyć ty nativus inny dane! jeśli chcieć kupić dużo konto jednocześnąć dostawać rabaty ojciec połowa cena przy minuta 5 sztuk! zachęcać dojciec zakup nativus pewny ty się opłacić sprawdzić nas! być konkurencyjny oda inny ofert! wysyłka przez kurier inpost lubić paczkomat możliwość wysyłka za pobranie czas realizacja zamówienie być szybki! gwarantować zadowolić klient i 100% satysfakcja ezyt zakup konta, wysyłka być wliczyć wyspa cena gratis!",0,35,11.31236623438021,0.00700456113583914,175.0,0.10829207920792079,1937,676,14,7,0,115,,,54,,0,6,1
